Title	Assignees	Status	Sprint	Estimated Size	Real Size
Host first meeting with MUMBI (industry partner)	saramakishti	Feature Archive	Sprint 0	1	1
Upload Feature Board Snapshot in GitHub (Sprint 0)	saramakishti	Feature Archive	Sprint 0	1	1
Upload Planning Document in GitHub (Sprint 0)	saramakishti	Feature Archive	Sprint 0	1	1
Upload Imp-Squared Board in GitHub (Sprint 0)	saramakishti	Feature Archive	Sprint 0	1	1
Design team logo and upload in GitHub		AMOS PO Items	Sprint 1	2	
Design team T-shirt and upload in GitHub		AMOS PO Items	Sprint 1	2	